[
  {
    "id": "y3-l50-v001",
    "schoolYear": 3,
    "book": "初級 II",
    "lesson": 50,
    "kana": "まいります |ます| / まいる |辞|",
    "meaningZh": "Ⅰ 自 來、去（「きます、いきます」的謙遜語）",
    "category": "動詞",
    "source": {
      "type": "school_pdf",
      "filename": "japanese_vocab_lv1_ch50.pdf.pdf"
    },
    "kanji": "参ります / 参る"
  },
  {
    "id": "y3-l50-v002",
    "schoolYear": 3,
    "book": "初級 II",
    "lesson": 50,
    "kana": "おります |ます| / おる |辞|",
    "meaningZh": "Ⅰ 自 在（「います」的謙遜語）",
    "category": "動詞",
    "source": {
      "type": "school_pdf",
      "filename": "japanese_vocab_lv1_ch50.pdf.pdf"
    },
    "kanji": "-"
  },
  {
    "id": "y3-l50-v003",
    "schoolYear": 3,
    "book": "初級 II",
    "lesson": 50,
    "kana": "いただきます |ます| / いただく |辞|",
    "meaningZh": "Ⅰ 他 吃、喝、得到（「たべます、のみます、もらいます」的謙遜語）",
    "category": "動詞",
    "source": {
      "type": "school_pdf",
      "filename": "japanese_vocab_lv1_ch50.pdf.pdf"
    },
    "kanji": "-"
  },
  {
    "id": "y3-l50-v004",
    "schoolYear": 3,
    "book": "初級 II",
    "lesson": 50,
    "kana": "もうします |ます| / もうす |辞|",
    "meaningZh": "Ⅰ 他 說、叫（「いいます」的謙遜語）",
    "category": "動詞",
    "source": {
      "type": "school_pdf",
      "filename": "japanese_vocab_lv1_ch50.pdf.pdf"
    },
    "kanji": "申します / 申す"
  },
  {
    "id": "y3-l50-v005",
    "schoolYear": 3,
    "book": "初級 II",
    "lesson": 50,
    "kana": "いたします |ます| / いたす |辞|",
    "meaningZh": "Ⅰ 他 做（「します」的謙遜語）",
    "category": "動詞",
    "source": {
      "type": "school_pdf",
      "filename": "japanese_vocab_lv1_ch50.pdf.pdf"
    },
    "kanji": "-"
  },
  {
    "id": "y3-l50-v006",
    "schoolYear": 3,
    "book": "初級 II",
    "lesson": 50,
    "kana": "はいけんします |ます| / はいけんする |辞|",
    "meaningZh": "Ⅲ 他 看（「みます」的謙遜語）",
    "category": "動詞",
    "source": {
      "type": "school_pdf",
      "filename": "japanese_vocab_lv1_ch50.pdf.pdf"
    },
    "kanji": "拝見します / 拝見する"
  },
  {
    "id": "y3-l50-v007",
    "schoolYear": 3,
    "book": "初級 II",
    "lesson": 50,
    "kana": "ぞんじます |ます| / ぞんじる |辞|",
    "meaningZh": "Ⅱ 他 知道（「知ります」的謙遜語）",
    "category": "動詞",
    "source": {
      "type": "school_pdf",
      "filename": "japanese_vocab_lv1_ch50.pdf.pdf"
    },
    "kanji": "存じます / 存じる"
  },
  {
    "id": "y3-l50-v008",
    "schoolYear": 3,
    "book": "初級 II",
    "lesson": 50,
    "kana": "うかがいます |ます| / 伺う |辞|",
    "meaningZh": "Ⅰ 自 聼、詢問、拜訪（「ききます、いきます」的謙遜語）",
    "category": "動詞",
    "source": {
      "type": "school_pdf",
      "filename": "japanese_vocab_lv1_ch50.pdf.pdf"
    },
    "kanji": "伺います / 伺う"
  },
  {
    "id": "y3-l50-v009",
    "schoolYear": 3,
    "book": "初級 II",
    "lesson": 50,
    "kana": "おめにかかります |ます| / おめにかかる |辞|",
    "meaningZh": "Ⅰ 自 見面（「会います」的謙遜語）",
    "category": "動詞",
    "source": {
      "type": "school_pdf",
      "filename": "japanese_vocab_lv1_ch50.pdf.pdf"
    },
    "kanji": "お目にかかります / お目にかかる"
  },
  {
    "id": "y3-l50-v010",
    "schoolYear": 3,
    "book": "初級 II",
    "lesson": 50,
    "kana": "いれます [コーヒーを～] |ます| / いれる |辞|",
    "meaningZh": "Ⅱ 他 沏、泡［咖啡］",
    "category": "動詞",
    "source": {
      "type": "school_pdf",
      "filename": "japanese_vocab_lv1_ch50.pdf.pdf"
    },
    "kanji": "-"
  },
  {
    "id": "y3-l50-v011",
    "schoolYear": 3,
    "book": "初級 II",
    "lesson": 50,
    "kana": "よういします |ます| / よういする |辞|",
    "meaningZh": "Ⅲ 他 準備",
    "category": "動詞",
    "source": {
      "type": "school_pdf",
      "filename": "japanese_vocab_lv1_ch50.pdf.pdf"
    },
    "kanji": "用意します / 用意する"
  },
  {
    "id": "y3-l50-v012",
    "schoolYear": 3,
    "book": "初級 II",
    "lesson": 50,
    "kana": "きんちょうします |ます| / きんちょうする |辞|",
    "meaningZh": "Ⅲ 自 緊張",
    "category": "動詞",
    "source": {
      "type": "school_pdf",
      "filename": "japanese_vocab_lv1_ch50.pdf.pdf"
    },
    "kanji": "緊張します / 緊張する"
  },
  {
    "id": "y3-l50-v013",
    "schoolYear": 3,
    "book": "初級 II",
    "lesson": 50,
    "kana": "かないます [ゆめが～] |ます| / かなう |辞|",
    "meaningZh": "Ⅰ 自 實現［夢想］",
    "category": "動詞",
    "source": {
      "type": "school_pdf",
      "filename": "japanese_vocab_lv1_ch50.pdf.pdf"
    },
    "kanji": "かないます [夢が～]"
  },
  {
    "id": "y3-l50-v032",
    "schoolYear": 3,
    "book": "初級 II",
    "lesson": 50,
    "kana": "おうえんします |ます| / おうえんする |辞|",
    "kanji": "応援します / 応援する",
    "meaningZh": "Ⅲ 他 支持、聲援",
    "category": "動詞",
    "source": {
      "type": "school_pdf",
      "filename": "japanese_vocab_lv1_ch50.pdf.pdf"
    }
  },
  {
    "id": "y3-l50-v014",
    "schoolYear": 3,
    "book": "初級 II",
    "lesson": 50,
    "kana": "かんしゃします",
    "meaningZh": "感謝",
    "category": "動詞",
    "source": {
      "type": "school_pdf",
      "filename": "japanese_vocab_lv1_ch50.pdf.pdf"
    }
  },
  {
    "id": "y3-l50-v015",
    "schoolYear": 3,
    "book": "初級 II",
    "lesson": 50,
    "kana": "わたくし 私 我（「わたし」的謙遜語）",
    "meaningZh": "16 わたくし 私 我（「わたし」的謙遜語）",
    "category": "名詞",
    "source": {
      "type": "school_pdf",
      "filename": "japanese_vocab_lv1_ch50.pdf.pdf"
    }
  },
  {
    "id": "y3-l50-v016",
    "schoolYear": 3,
    "book": "初級 II",
    "lesson": 50,
    "kana": "ガイド - 向導、導遊",
    "meaningZh": "向導、導遊",
    "category": "名詞",
    "source": {
      "type": "school_pdf",
      "filename": "japanese_vocab_lv1_ch50.pdf.pdf"
    }
  },
  {
    "id": "y3-l50-v017",
    "schoolYear": 3,
    "book": "初級 II",
    "lesson": 50,
    "kana": "メールアドレス - 電子郵箱地址",
    "meaningZh": "電子郵箱地址",
    "category": "名詞",
    "source": {
      "type": "school_pdf",
      "filename": "japanese_vocab_lv1_ch50.pdf.pdf"
    }
  },
  {
    "id": "y3-l50-v018",
    "schoolYear": 3,
    "book": "初級 II",
    "lesson": 50,
    "kana": "スケジュール - 日程",
    "meaningZh": "日程",
    "category": "名詞",
    "source": {
      "type": "school_pdf",
      "filename": "japanese_vocab_lv1_ch50.pdf.pdf"
    }
  },
  {
    "id": "y3-l50-v019",
    "schoolYear": 3,
    "book": "初級 II",
    "lesson": 50,
    "kana": "さらいしゅう さ来週 下下個星期",
    "meaningZh": "20 さらいしゅう さ来週 下下個星期",
    "category": "名詞",
    "source": {
      "type": "school_pdf",
      "filename": "japanese_vocab_lv1_ch50.pdf.pdf"
    }
  },
  {
    "id": "y3-l50-v020",
    "schoolYear": 3,
    "book": "初級 II",
    "lesson": 50,
    "kana": "さらいげつ さ来月 下下個月",
    "meaningZh": "21 さらいげつ さ来月 下下個月",
    "category": "名詞",
    "source": {
      "type": "school_pdf",
      "filename": "japanese_vocab_lv1_ch50.pdf.pdf"
    }
  },
  {
    "id": "y3-l50-v021",
    "schoolYear": 3,
    "book": "初級 II",
    "lesson": 50,
    "kana": "さらいねん さ来年 後年",
    "meaningZh": "22 さらいねん さ来年 後年",
    "category": "名詞",
    "source": {
      "type": "school_pdf",
      "filename": "japanese_vocab_lv1_ch50.pdf.pdf"
    }
  },
  {
    "id": "y3-l50-v022",
    "schoolYear": 3,
    "book": "初級 II",
    "lesson": 50,
    "kana": "はじめに 初めに 首先",
    "meaningZh": "23 はじめに 初めに 首先",
    "category": "名詞",
    "source": {
      "type": "school_pdf",
      "filename": "japanese_vocab_lv1_ch50.pdf.pdf"
    }
  },
  {
    "id": "y3-l50-v023",
    "schoolYear": 3,
    "book": "初級 II",
    "lesson": 50,
    "kana": "しょうきん 賞金 獎金",
    "meaningZh": "24 しょうきん 賞金 獎金",
    "category": "名詞",
    "source": {
      "type": "school_pdf",
      "filename": "japanese_vocab_lv1_ch50.pdf.pdf"
    }
  },
  {
    "id": "y3-l50-v024",
    "schoolYear": 3,
    "book": "初級 II",
    "lesson": 50,
    "kana": "きりん - 長頸鹿",
    "meaningZh": "長頸鹿",
    "category": "名詞",
    "source": {
      "type": "school_pdf",
      "filename": "japanese_vocab_lv1_ch50.pdf.pdf"
    }
  },
  {
    "id": "y3-l50-v025",
    "schoolYear": 3,
    "book": "初級 II",
    "lesson": 50,
    "kana": "ころ - 時候",
    "meaningZh": "時候",
    "category": "名詞",
    "source": {
      "type": "school_pdf",
      "filename": "japanese_vocab_lv1_ch50.pdf.pdf"
    }
  },
  {
    "id": "y3-l50-v026",
    "schoolYear": 3,
    "book": "初級 II",
    "lesson": 50,
    "kana": "こころから 心から 衷心",
    "meaningZh": "平仮名/片仮名 漢字 中譯",
    "category": "其他",
    "source": {
      "type": "school_pdf",
      "filename": "japanese_vocab_lv1_ch50.pdf.pdf"
    }
  },
  {
    "id": "y3-l50-v027",
    "schoolYear": 3,
    "book": "初級 II",
    "lesson": 50,
    "kana": "えどとうきょうはくぶつか",
    "meaningZh": "平仮名/片仮名 漢字 中譯",
    "category": "固有名詞",
    "source": {
      "type": "school_pdf",
      "filename": "japanese_vocab_lv1_ch50.pdf.pdf"
    }
  },
  {
    "id": "y3-l50-v028",
    "schoolYear": 3,
    "book": "初級 II",
    "lesson": 50,
    "kana": "おれい お礼 致謝、感謝（表示謝意的寒",
    "meaningZh": "すか」的尊敬語）",
    "category": "読み物",
    "source": {
      "type": "school_pdf",
      "filename": "japanese_vocab_lv1_ch50.pdf.pdf"
    }
  },
  {
    "id": "y3-l50-v033",
    "schoolYear": 3,
    "book": "初級 II",
    "lesson": 50,
    "kana": "おげんきでいらっしゃいますか。",
    "kanji": "お元気でいらっしゃいますか。",
    "meaningZh": "身體好嗎？（「おげんきですか」的尊敬語）",
    "category": "読み物",
    "source": {
      "type": "school_pdf",
      "filename": "japanese_vocab_lv1_ch50.pdf.pdf"
    }
  },
  {
    "id": "y3-l50-v029",
    "schoolYear": 3,
    "book": "初級 II",
    "lesson": 50,
    "kana": "めいわくをかけます 迷惑をかけます 添麻煩",
    "meaningZh": "31 めいわくをかけます 迷惑をかけます 添麻煩",
    "category": "読み物",
    "source": {
      "type": "school_pdf",
      "filename": "japanese_vocab_lv1_ch50.pdf.pdf"
    }
  },
  {
    "id": "y3-l50-v030",
    "schoolYear": 3,
    "book": "初級 II",
    "lesson": 50,
    "kana": "いかします 生かします 發揮、運用",
    "meaningZh": "32 いかします 生かします 發揮、運用",
    "category": "読み物",
    "source": {
      "type": "school_pdf",
      "filename": "japanese_vocab_lv1_ch50.pdf.pdf"
    }
  },
  {
    "id": "y3-l50-v031",
    "schoolYear": 3,
    "book": "初級 II",
    "lesson": 50,
    "kana": "ミュンヘン - 慕尼黑（德國）",
    "meaningZh": "慕尼黑（德國）",
    "category": "読み物",
    "source": {
      "type": "school_pdf",
      "filename": "japanese_vocab_lv1_ch50.pdf.pdf"
    }
  }
]
