[
  {
    "id": "y3-l48-v001",
    "schoolYear": 3,
    "book": "初級 II",
    "lesson": 48,
    "kana": "おろします",
    "meaningZh": "放下來、卸下來",
    "category": "動詞",
    "source": {
      "type": "school_pdf",
      "filename": "japanese_vocab_lv1_ch48.pdf.pdf"
    }
  },
  {
    "id": "y3-l48-v002",
    "schoolYear": 3,
    "book": "初級 II",
    "lesson": 48,
    "kana": "とどけます",
    "meaningZh": "遞送、送到",
    "category": "動詞",
    "source": {
      "type": "school_pdf",
      "filename": "japanese_vocab_lv1_ch48.pdf.pdf"
    }
  },
  {
    "id": "y3-l48-v003",
    "schoolYear": 3,
    "book": "初級 II",
    "lesson": 48,
    "kana": "せわをします",
    "meaningZh": "照顧、照料",
    "category": "動詞",
    "source": {
      "type": "school_pdf",
      "filename": "japanese_vocab_lv1_ch48.pdf.pdf"
    }
  },
  {
    "id": "y3-l48-v004",
    "schoolYear": 3,
    "book": "初級 II",
    "lesson": 48,
    "kana": "ろくおんします",
    "meaningZh": "錄音",
    "category": "動詞",
    "source": {
      "type": "school_pdf",
      "filename": "japanese_vocab_lv1_ch48.pdf.pdf"
    }
  },
  {
    "id": "y3-l48-v005",
    "schoolYear": 3,
    "book": "初級 II",
    "lesson": 48,
    "kana": "たのしみます",
    "meaningZh": "享受、享樂",
    "category": "動詞",
    "source": {
      "type": "school_pdf",
      "filename": "japanese_vocab_lv1_ch48.pdf.pdf"
    }
  },
  {
    "id": "y3-l48-v006",
    "schoolYear": 3,
    "book": "初級 II",
    "lesson": 48,
    "kana": "じゅく 塾 私塾、補習班",
    "meaningZh": "7 じゅく 塾 私塾、補習班",
    "category": "名詞",
    "source": {
      "type": "school_pdf",
      "filename": "japanese_vocab_lv1_ch48.pdf.pdf"
    }
  },
  {
    "id": "y3-l48-v007",
    "schoolYear": 3,
    "book": "初級 II",
    "lesson": 48,
    "kana": "せいと 生徒 學生（中小學生）",
    "meaningZh": "8 せいと 生徒 學生（中小學生）",
    "category": "名詞",
    "source": {
      "type": "school_pdf",
      "filename": "japanese_vocab_lv1_ch48.pdf.pdf"
    }
  },
  {
    "id": "y3-l48-v008",
    "schoolYear": 3,
    "book": "初級 II",
    "lesson": 48,
    "kana": "ファイル - 文件夾",
    "meaningZh": "文件夾",
    "category": "名詞",
    "source": {
      "type": "school_pdf",
      "filename": "japanese_vocab_lv1_ch48.pdf.pdf"
    }
  },
  {
    "id": "y3-l48-v009",
    "schoolYear": 3,
    "book": "初級 II",
    "lesson": 48,
    "kana": "じゆうに 自由に 自由地、隨意地",
    "meaningZh": "10 じゆうに 自由に 自由地、隨意地",
    "category": "名詞",
    "source": {
      "type": "school_pdf",
      "filename": "japanese_vocab_lv1_ch48.pdf.pdf"
    }
  },
  {
    "id": "y3-l48-v010",
    "schoolYear": 3,
    "book": "初級 II",
    "lesson": 48,
    "kana": "～かん ～間 ～期間",
    "meaningZh": "11 ～かん ～間 ～期間",
    "category": "名詞",
    "source": {
      "type": "school_pdf",
      "filename": "japanese_vocab_lv1_ch48.pdf.pdf"
    }
  },
  {
    "id": "y3-l48-v011",
    "schoolYear": 3,
    "book": "初級 II",
    "lesson": 48,
    "kana": "えいぎょう 営業 營業",
    "meaningZh": "平仮名/片仮名 漢字 中譯",
    "category": "名詞",
    "source": {
      "type": "school_pdf",
      "filename": "japanese_vocab_lv1_ch48.pdf.pdf"
    }
  },
  {
    "id": "y3-l48-v012",
    "schoolYear": 3,
    "book": "初級 II",
    "lesson": 48,
    "kana": "いや [な] 嫌 [な] 討厭、不喜歡",
    "meaningZh": "1 / 2平仮名/片仮名 漢字 中譯",
    "category": "な形容詞",
    "source": {
      "type": "school_pdf",
      "filename": "japanese_vocab_lv1_ch48.pdf.pdf"
    }
  },
  {
    "id": "y3-l48-v013",
    "schoolYear": 3,
    "book": "初級 II",
    "lesson": 48,
    "kana": "いいことですね。 - 是件好事啊。",
    "meaningZh": "是件好事啊。",
    "category": "其他",
    "source": {
      "type": "school_pdf",
      "filename": "japanese_vocab_lv1_ch48.pdf.pdf"
    }
  },
  {
    "id": "y3-l48-v014",
    "schoolYear": 3,
    "book": "初級 II",
    "lesson": 48,
    "kana": "おいそがしいですか。 お忙しいですか。 您忙嗎？（用於和上司、長",
    "meaningZh": "輩打招呼時）",
    "category": "其他",
    "source": {
      "type": "school_pdf",
      "filename": "japanese_vocab_lv1_ch48.pdf.pdf"
    }
  },
  {
    "id": "y3-l48-v015",
    "schoolYear": 3,
    "book": "初級 II",
    "lesson": 48,
    "kana": "それまでに - 在那之前",
    "meaningZh": "在那之前",
    "category": "其他",
    "source": {
      "type": "school_pdf",
      "filename": "japanese_vocab_lv1_ch48.pdf.pdf"
    }
  },
  {
    "id": "y3-l48-v016",
    "schoolYear": 3,
    "book": "初級 II",
    "lesson": 48,
    "kana": "かまいません。 - 沒關係。",
    "meaningZh": "沒關係。",
    "category": "其他",
    "source": {
      "type": "school_pdf",
      "filename": "japanese_vocab_lv1_ch48.pdf.pdf"
    }
  },
  {
    "id": "y3-l48-v017",
    "schoolYear": 3,
    "book": "初級 II",
    "lesson": 48,
    "kana": "おや 親 父母",
    "meaningZh": "17 おや 親 父母",
    "category": "読み物",
    "source": {
      "type": "school_pdf",
      "filename": "japanese_vocab_lv1_ch48.pdf.pdf"
    }
  },
  {
    "id": "y3-l48-v018",
    "schoolYear": 3,
    "book": "初級 II",
    "lesson": 48,
    "kana": "しょうがくせい 小学生 小學生",
    "meaningZh": "18 しょうがくせい 小学生 小學生",
    "category": "読み物",
    "source": {
      "type": "school_pdf",
      "filename": "japanese_vocab_lv1_ch48.pdf.pdf"
    }
  },
  {
    "id": "y3-l48-v019",
    "schoolYear": 3,
    "book": "初級 II",
    "lesson": 48,
    "kana": "－パーセント - 百分之一",
    "meaningZh": "百分之一",
    "category": "読み物",
    "source": {
      "type": "school_pdf",
      "filename": "japanese_vocab_lv1_ch48.pdf.pdf"
    }
  },
  {
    "id": "y3-l48-v020",
    "schoolYear": 3,
    "book": "初級 II",
    "lesson": 48,
    "kana": "そのつぎ その次 其次",
    "meaningZh": "20 そのつぎ その次 其次",
    "category": "読み物",
    "source": {
      "type": "school_pdf",
      "filename": "japanese_vocab_lv1_ch48.pdf.pdf"
    }
  },
  {
    "id": "y3-l48-v021",
    "schoolYear": 3,
    "book": "初級 II",
    "lesson": 48,
    "kana": "しゅうじ 習字 習字、書法",
    "meaningZh": "21 しゅうじ 習字 習字、書法",
    "category": "読み物",
    "source": {
      "type": "school_pdf",
      "filename": "japanese_vocab_lv1_ch48.pdf.pdf"
    }
  },
  {
    "id": "y3-l48-v022",
    "schoolYear": 3,
    "book": "初級 II",
    "lesson": 48,
    "kana": "ふつうの 普通の 普通的",
    "meaningZh": "22 ふつうの 普通の 普通的",
    "category": "読み物",
    "source": {
      "type": "school_pdf",
      "filename": "japanese_vocab_lv1_ch48.pdf.pdf"
    }
  }
]

